{
  "name": "Example Name",
  "guid": "5a401af8-d2e2-4090-8c45-9f87b8b6c4d1",
  "multiLocationId": "string",
  "fixedPrice": 1.0,
  "multiplicationFactor": 1.0,
  "displayMode": "PREFIX",
  "posName": "string",
  "posButtonColorLight": "string",
  "posButtonColorDark": "string",
  "chargeAsExtra": true,
  "plu": "string"
}